{
  "schema_version": "1.1",
  "case_id": "synthetic-thermal-interface-v1-1",
  "as_of": "2026-09-18T14:00:00Z",
  "research_cutoff": "2026-09-18T14:00:00Z",
  "question": "Does the fictional issuer convert a qualified supply constraint into durable per-share economics?",
  "security_identity": {
    "issuer_id": "issuer-aurora-grid-components",
    "legal_name": "Aurora Grid Components Ltd",
    "ticker": "AGC",
    "exchange": "SYNTHETIC",
    "mic": null,
    "security_type": "COMMON_STOCK",
    "primary_listing": "SYNTHETIC",
    "country": "Syntheticland",
    "trading_currency": "USD",
    "reporting_currency": "USD",
    "regulator_id": null,
    "status": "SUPPORTED",
    "evidence_ids": ["ev-market"]
  },
  "data_availability": {
    "manifest_id": "availability-synthetic-001",
    "as_of": "2026-09-18T14:00:00Z",
    "adapters": [
      {
        "adapter_id": "synthetic-market-and-filings",
        "provider": "project-authored-fixture",
        "capabilities": ["SECURITY_IDENTITY", "OFFICIAL_CLOSE", "FUNDAMENTALS", "CUSTOMER_SIGNAL", "POLICY"],
        "markets": ["SYNTHETIC"],
        "availability": "AVAILABLE",
        "latency_class": "BATCH",
        "entitlement_status": "ENTITLED",
        "last_success_at": "2026-09-18T14:00:00Z",
        "last_error": null,
        "freshness_policy": "Fixture values are valid only at the declared cutoff."
      }
    ]
  },
  "system_shift": {
    "claim_id": "claim-system-shift",
    "description": "Higher rack density increases the need for qualified thermal-interface material.",
    "status": "SUPPORTED",
    "event_date": "2026-09-10T00:00:00Z",
    "evidence_ids": ["ev-system"]
  },
  "claims": [
    {
      "claim_id": "claim-system-shift",
      "statement": "The fictional platform shift increases demand for qualified thermal-interface material.",
      "subject": "fictional-platform",
      "predicate": "increases_demand_for",
      "object": "thermal-interface-material",
      "scope": "fictional platform route",
      "epistemic_type": "FACT",
      "evidence_state": "SUPPORTED",
      "as_of": "2026-09-18T14:00:00Z",
      "confidence": 0.95,
      "evidence_links": ["link-system"],
      "counterevidence_links": [],
      "unknowns": [],
      "derivation_access": "SYNTHETIC"
    },
    {
      "claim_id": "claim-edge",
      "statement": "Aurora supplies the qualified interface material used by the fictional platform route.",
      "subject": "issuer-aurora-grid-components",
      "predicate": "supplies",
      "object": "thermal-interface-material",
      "scope": "fictional platform route",
      "epistemic_type": "FACT",
      "evidence_state": "SUPPORTED",
      "as_of": "2026-09-18T14:00:00Z",
      "confidence": 0.9,
      "evidence_links": ["link-edge", "link-issuer"],
      "counterevidence_links": [],
      "unknowns": [],
      "derivation_access": "SYNTHETIC"
    },
    {
      "claim_id": "claim-customer",
      "statement": "Two fictional customers have qualified the current material generation.",
      "subject": "thermal-interface-material",
      "predicate": "has_customer_qualification",
      "object": "two-fictional-customers",
      "scope": "current generation",
      "epistemic_type": "FACT",
      "evidence_state": "SUPPORTED",
      "as_of": "2026-09-18T14:00:00Z",
      "confidence": 0.88,
      "evidence_links": ["link-customer"],
      "counterevidence_links": [],
      "unknowns": [],
      "derivation_access": "SYNTHETIC"
    },
    {
      "claim_id": "claim-market",
      "statement": "The declared official close and share count imply a synthetic market capitalization of USD 420 million.",
      "subject": "issuer-aurora-grid-components",
      "predicate": "has_market_cap",
      "object": "420000000 USD",
      "scope": "2026-09-16 official close",
      "epistemic_type": "INFERENCE",
      "evidence_state": "SUPPORTED",
      "as_of": "2026-09-18T14:00:00Z",
      "confidence": 1.0,
      "evidence_links": ["link-market"],
      "counterevidence_links": [],
      "unknowns": [],
      "derivation_access": "SYNTHETIC"
    }
  ],
  "claim_evidence_links": [
    { "link_id": "link-system", "claim_id": "claim-system-shift", "evidence_id": "ev-system", "relation": "DIRECT_SUPPORT", "support_scope": "system shift" },
    { "link_id": "link-edge", "claim_id": "claim-edge", "evidence_id": "ev-edge", "relation": "DIRECT_SUPPORT", "support_scope": "supplier relationship" },
    { "link_id": "link-issuer", "claim_id": "claim-edge", "evidence_id": "ev-issuer", "relation": "CONTEXT", "support_scope": "issuer role" },
    { "link_id": "link-customer", "claim_id": "claim-customer", "evidence_id": "ev-customer", "relation": "DIRECT_SUPPORT", "support_scope": "qualification" },
    { "link_id": "link-market", "claim_id": "claim-market", "evidence_id": "ev-market", "relation": "DIRECT_SUPPORT", "support_scope": "price and shares" }
  ],
  "evidence": [
    { "evidence_id": "ev-system", "source_type": "synthetic system fixture", "source_locator": "synthetic://system-shift", "source_perspective": "SYNTHETIC", "published_at": "2026-09-10T00:00:00Z", "known_at": "2026-09-10T00:00:00Z", "effective_at": "2026-09-10T00:00:00Z", "effective_from": null, "effective_to": null, "retrieved_at": "2026-09-18T14:00:00Z", "time_precision": "DATE", "access_class": "SYNTHETIC", "redistribution_rights": "ALLOWED", "citation_status": "CITABLE", "independence_group": "synthetic-system", "evidence_state": "SUPPORTED" },
    { "evidence_id": "ev-edge", "source_type": "synthetic supply-chain fixture", "source_locator": "synthetic://dependency-edge", "source_perspective": "SYNTHETIC", "published_at": "2026-09-11T00:00:00Z", "known_at": "2026-09-11T00:00:00Z", "effective_at": "2026-09-11T00:00:00Z", "effective_from": null, "effective_to": null, "retrieved_at": "2026-09-18T14:00:00Z", "time_precision": "DATE", "access_class": "SYNTHETIC", "redistribution_rights": "ALLOWED", "citation_status": "CITABLE", "independence_group": "synthetic-edge", "evidence_state": "SUPPORTED" },
    { "evidence_id": "ev-supply", "source_type": "synthetic capacity fixture", "source_locator": "synthetic://supply-state", "source_perspective": "SYNTHETIC", "published_at": "2026-09-12T00:00:00Z", "known_at": "2026-09-12T00:00:00Z", "effective_at": "2026-09-12T00:00:00Z", "effective_from": null, "effective_to": null, "retrieved_at": "2026-09-18T14:00:00Z", "time_precision": "DATE", "access_class": "SYNTHETIC", "redistribution_rights": "ALLOWED", "citation_status": "CITABLE", "independence_group": "synthetic-supply", "evidence_state": "SUPPORTED" },
    { "evidence_id": "ev-customer", "source_type": "synthetic customer fixture", "source_locator": "synthetic://customer-validation", "source_perspective": "CUSTOMER", "published_at": "2026-09-13T00:00:00Z", "known_at": "2026-09-13T00:00:00Z", "effective_at": "2026-09-13T00:00:00Z", "effective_from": null, "effective_to": null, "retrieved_at": "2026-09-18T14:00:00Z", "time_precision": "DATE", "access_class": "SYNTHETIC", "redistribution_rights": "ALLOWED", "citation_status": "CITABLE", "independence_group": "synthetic-customer", "evidence_state": "SUPPORTED" },
    { "evidence_id": "ev-issuer", "source_type": "synthetic issuer fixture", "source_locator": "synthetic://issuer-profile", "source_perspective": "ISSUER", "published_at": "2026-09-14T00:00:00Z", "known_at": "2026-09-14T00:00:00Z", "effective_at": "2026-09-14T00:00:00Z", "effective_from": null, "effective_to": null, "retrieved_at": "2026-09-18T14:00:00Z", "time_precision": "DATE", "access_class": "SYNTHETIC", "redistribution_rights": "ALLOWED", "citation_status": "CITABLE", "independence_group": "synthetic-issuer", "evidence_state": "SUPPORTED" },
    { "evidence_id": "ev-market", "source_type": "synthetic official close fixture", "source_locator": "synthetic://market-state", "source_perspective": "EXCHANGE", "published_at": "2026-09-16T00:00:00Z", "known_at": "2026-09-16T00:00:00Z", "effective_at": "2026-09-16T00:00:00Z", "effective_from": null, "effective_to": null, "retrieved_at": "2026-09-18T14:00:00Z", "time_precision": "DATE", "access_class": "SYNTHETIC", "redistribution_rights": "ALLOWED", "citation_status": "CITABLE", "independence_group": "synthetic-market", "evidence_state": "SUPPORTED" },
    { "evidence_id": "ev-financial", "source_type": "synthetic financial fixture", "source_locator": "synthetic://capital-bridge", "source_perspective": "ISSUER", "published_at": "2026-09-15T00:00:00Z", "known_at": "2026-09-15T00:00:00Z", "effective_at": "2026-09-15T00:00:00Z", "effective_from": null, "effective_to": null, "retrieved_at": "2026-09-18T14:00:00Z", "time_precision": "DATE", "access_class": "SYNTHETIC", "redistribution_rights": "ALLOWED", "citation_status": "CITABLE", "independence_group": "synthetic-finance", "evidence_state": "SUPPORTED" },
    { "evidence_id": "ev-geo", "source_type": "synthetic policy fixture", "source_locator": "synthetic://geo-policy", "source_perspective": "GOVERNMENT", "published_at": "2026-09-15T00:00:00Z", "known_at": "2026-09-15T00:00:00Z", "effective_at": "2026-09-15T00:00:00Z", "effective_from": null, "effective_to": null, "retrieved_at": "2026-09-18T14:00:00Z", "time_precision": "DATE", "access_class": "SYNTHETIC", "redistribution_rights": "ALLOWED", "citation_status": "CITABLE", "independence_group": "synthetic-geo", "evidence_state": "SUPPORTED" },
    { "evidence_id": "ev-reflexivity", "source_type": "synthetic market behavior fixture", "source_locator": "synthetic://reflexivity", "source_perspective": "MARKET_DATA_PROVIDER", "published_at": "2026-09-16T00:00:00Z", "known_at": "2026-09-16T00:00:00Z", "effective_at": "2026-09-16T00:00:00Z", "effective_from": null, "effective_to": null, "retrieved_at": "2026-09-18T14:00:00Z", "time_precision": "DATE", "access_class": "SYNTHETIC", "redistribution_rights": "ALLOWED", "citation_status": "CITABLE", "independence_group": "synthetic-reflexivity", "evidence_state": "SUPPORTED" },